#Question	WH	WH-Bigram	WH-POS	WH-NBOR-POS	Root-POS	ClassWhat is the definition of low island ?	What	What is	WP	VBZ	VBZ	DESCWhat century does Captain Video live in ?	What	What century	WDT	NN	VB	NUMWhat types of water pollution are there ?	What	What types	WDT	NNS	VBP	ENTYHow many astronauts manned each Project Mercury flight ?	How	How many	WRB	JJ	VBD	NUMWhat soft drink would provide me with the biggest intake of caffeine ?	What	What soft	WDT	JJ	VB	ENTYWhat 's the name of a golf course in Myrtle Beach ?	What	What 's	WP	VBZ	VBZ	ENTYWhat are some of the significant historical events of the 1990s ?	What	What are	WP	VBP	VBP	ENTYName the only extant trilogy of classical Greek plays .					VB	ENTYWhere is Logan Airport ?	Where	Where is	WRB	VBZ	VBZ	LOCWhat is the difference between Neoclassical art and Romanticism art ?	What	What is	WP	VBZ	VBZ	DESCWho was the first person inducted into the U.S. Swimming Hall of Fame ?	Who	Who was	WP	VBD	VBD	HUMWhat golfer has been called Ohio Fats and Blobbo ?	What	What golfer	WDT	NN	VBN	HUMWho murdered Leno and Rosemary LaBianca on August 1	Who	Who murdered	WP	VBD	VBD	HUMWhat is the average cost for four years of medical school ?	What	What is	WP	VBZ	VBZ	NUMWhat does God create in the first sentence of the Bible ?	What	What does	WP	VBZ	VB	ENTYWhich of the following men was not married to Rita Hayworth ?	Which	Which of	WDT	IN	VBD	HUMWhat is the current ticket fare from from Cairo to Barbados ?	What	What is	WP	VBZ	VBZ	NUMWhat does NN O `` mean when used as a prefix in Irish surnames ?	when	What does when used	WRB	VBN	WP	ABBRHow do you find oxidation numbers ?	How	How do	WRB	VBP	VB	DESCWhat is the state nickname of Mississippi ?	What	What is	WP	VBZ	VBZ	LOC"What is Black Hills , South Dakota most famous for ?"	What	What is	WP	VBZ	VBZ	DESCWhat 1966 boob tube bomb took astronauts back to prehistoric times ?	What	What 1966	WP	CD	VBD	ENTYHow many students attend the University of Massachusetts ?	How	How many	WRB	JJ	VBP	NUM"Who said , `` I shall return . '' during World War Two ?"	Who	Who said	WP	VBD	VBD	HUMWhat holidays are celebrated in Ireland ?	What	What holidays	WDT	NNS	VBN	ENTY"Who portrayed Etta Place , companion to Butch Cassidey and the Sundance Kid ?"	Who	Who portrayed	WP	VBD	VBD	HUMWhat are the Greek numerals ?	What	What are	WP	VBP	VBP	DESCWhat 's the name of the temple that is located near the capital city of Laos ?	that	What 's that is	WDT	VBZ	VBZ	LOCWhat is a fear of sleep ?	What	What is	WP	VBZ	VBZ	ENTYWhat auto race was Wilbur Reed the first to win three times ?	What	What auto	WDT	NN	VBD	ENTYWhat are the most common breeding birds in the U.S. ?	What	What are	WP	VBP	VBP	ENTY"What was organized as a Confederate veterans ' social club in Pulaski , in Tennessee , in 1866 ?"	What	What was	WP	VBD	VBN	ENTYHow do you look up criminal records on the Internet ?	How	How do	WRB	VBP	VB	DESC"Where is the actress , Marion Davies , buried ?"	Where	Where is	WRB	VBZ	VBZ	LOCWhat is an example of an actual case of using the Fourteenth Amendment ?	What	What is	WP	VBZ	VBZ	DESCWho was the Charlie perfume woman ?	Who	Who was	WP	VBD	VBD	HUMWho portrayed `` Rosanne Rosanna-Dana '' on the television show `` Saturday Night Live '' ?	Who	Who portrayed	WP	VBD	VBD	HUM